id,source,rewrite_a,rewrite_b,issue,batch
26_llama_ppo_source_llama,"Yes, I understand the fact that there are studies showing how young men can be more reckless than women, however it is important to consider the underlying risk factors when considering insurance rates for both men and women. Rates should be based on an individual's driving history and other factors, rather than solely on gender. This is fairer for all genders and provides a more equitable insurance system.","Yes, I understand the fact that there are studies showing how young men can be more reckless than women, but that shouldn't be a good enough reason to treat men any differently than women. 

For example, ""Whites, who make up 78 percent of the U.S. population, accounted for 35 percent of the state prison population. Blacks, who make up 13 percent of the U.S. population, were 38 percent of the state prison population. Hispanics, who make up 17 percent of the U.S. population, were 21 percent of the state prison population."" Does this mean Blacks or Hispanics should be treated differently just because there are statistically more of them in prison? No. This, I feel, is a good analogy as to why men should be getting the same insurance rates as women.

I'm not a 'masculinist', but It just strikes me as unfair. I would love to hear some other opinions! Thank you for taking the time to read :]

Edit: I'm talking about car insurance.","Yes, I understand the fact that there are studies showing how young men can be more reckless than women, but that shouldn't be a good enough reason to treat men any differently than women. For example, ""Whites, who make up 78 percent of the U.S. population, accounted for 35 percent of the state prison population. Blacks, who make up 13 percent of the U.S. population, were 38 percent of the state prison population. Hispanics, who make up 17 percent of the U.S. population, were 21 percent of the state prison population."" Does this mean Blacks or Hispanics should be treated differently just because there are statistically more of them in prison? No. This, I feel, is a good analogy as to why men should be getting the same insurance rates as women. I'm not a 'masculinist', but It just strikes me as unfair. I would love to hear some other opinions! Thank you for taking the time to read :]",Cmv: higher insurance rates for young men is sexist.:,2
27_llama_llama_ppo_source,"So you dispute the Pontius Pilate account and testimony of the Jewish leaders? What crimes did Jesus supposedly commit? In fact, the Pharisees and Jewish leaders begged Pilate that a criminal be released so that they may torment Jesus. Pilate's wife begged that Jesus be released. Pilate himself was sorrowful and didn't sentence Jesus, rather washing his hands of the matter.  Hippie? I believe ""nomad"" would be a better term. And, in that case, he was no different than any other nomadic person or tribe. Most wore their hair long (except for proper Roman citizens), and togas or other robes. Sandals were the only footwear available. You are hardly justified in calling Jesus a hippie, much less the first hippie.  And by all accounts, Jesus was a Nazarene.  And Jesus being married is a fallacious assumption. The whole controversy is really based on whether or not He rose from the dead. Eye witness accounts claim that He did. What can you say to prove that He didn't?","So you dispute the testimony of Pontius Pilate and the Jewish leaders? What crimes Jesus supposedly committed is still uncertain, though some sources claim he was accused of claiming to be the king of the Jews, as well as distrupting order within the Temple. There is some evidence to suggest that he may have been seen as a subversive figure. While it is clear that Pilate was reluctant to sentence Jesus due to the political tensions at the time, it is also important to consider the accounts of those who claimed to have seen Jesus after his death, which suggests that he did indeed rise from the dead. While this cannot be proven, it is likely that Jesus was in fact married, though this is not as widely accepted.","So you dispute the Pontias Pilate account and testimony of the Jewish leaders? What crimes did Jesus supposedly commit? In fact, the Pharisees and Jewish leaders begged Pilate that a criminal be released so that they may torment Jesus. Pilate's wife begged that Jesus be released. Pilate himself was sorrowful and didn't sentence Jesus, rather washing his hands of the matter.
Hippie? I believe nomad would be a better term. And, in that case, he was no different than any other nomadic person or tribe. Most wore their hair long (except for proper Roman citizens), and togas or other robes. And sandals were the only footwear available. You are hardly justified in calling Jesus a hippie, much less the first hippie.
And by all accounts, Jesus was a Nazarene.
And Jesus being married is a fallacious assumption.
The whole controversey is really based on whether or not He rose from the dead. Eye witness accounts claim that he did. What can you say to prove that he didn't?",Who was jesus?   stance: christ:,2
28_llama_ppo_source_llama,"No matter how it is implemented, reservation can have both positive and negative effects. In India, reservation was initially implemented to provide economic equality and reduce social inequality, however it can also lead to some people taking advantage of the system. This can be seen both in the original 15-year implementation and the later Mandal Commission implementation, as it can benefit those in need while also benefitting some people who are already in a higher social class. It is important to ensure that these benefits are reaching those who need them in order to truly make an impact and reduce inequality.","No thing is bad or good in its own stead. It is the way it is used, implemented and taken up which makes it bad or good. In India reservation was and is used to please some people and get quick votes, be it SC&ST provisions in constitution which was original for 15 years or implementation of Mandal commission after years of lying in bag. There are many aspects of reservation. It is fact there are some strata of society who need support to rise from their current status of poverty or backwardness.


However there is opposition for reservation because the benefit of it are not going to actual people rather they are taken up by some people of these society who are already in up class are taking up these benefits whereas actual needy people are still at the same place. No one will object if a really needy get the benefit, You and all are furious since it is someone who is not needy who is reaping benefit.","No thing is bad or good in its own stead. It is the way it is used, implemented and taken up which makes it bad or good. In India reservation was and is used to please some people and get quick votes, be it SC&ST provisions in constitution which was originally implemented for 15 years or the implementation of the Mandal commission after years of lying dormant. There are many aspects of reservation. It is a fact that there are some strata of society who need support to rise from their current status of poverty or backwardness.  However, there is opposition to reservation because the benefit of it are not going to actual people rather they are being taken up by some people of these societies who are already in the upper class. These people are exploiting the system and the real needy are still at the same place. No one would object if a really needy person gets the benefit, You and all are furious since it is someone who is not in need who is reaping the benefits.","India reservation helps the people in it , it reduces the socialism,and economic equality?:",2
29_llama_source_llama_ppo,"I would say not all foreigners are seen as negatively as some Russian people may perceive them. It is understandable that some countries may have favorites and unfavorites, and Russia is no exception. The reasons for disliking certain foreigners may depend on the country they are from, as well as the individual's experiences. Not all foreigners are as violent, dishonest, and unkind as the worst offenders in the world. It is the government that is responsible for a country's actions, and it is the Russian people who ultimately pay for it.",I would say not all foreigners ..maybe unrealistic but it would depend on what country they are from ..er which country..Just as the entire world has favs and non favs.. I think the non favs for countries already know who they are and why...If a nation is violent and not good for the world and the government..lies and steals..and kills innocent humans..well then.. it is not well liked ..or the people either..because the government is suppose to represent the people..So...it is the government that causes it and their people that pay for it.,"I would say that not all foreigners are necessarily welcomed in Russia, as it depends on the country and the individual's experience. It is understandable why some countries may not receive a positive reception as there are some countries which are not well liked due to the government's actions. This could be seen in the way the government operates and their impact on the country as a whole, leading to a negative perception of some countries.",Why do russian people hate foreigners in their country?:,2
30_llama_source_llama_ppo,"Yes, freedom of speech should be unrestricted when it comes to religious statements. Freedom of speech is a right that should not be taken away, even if it means facing the consequences of those statements. We should respect the rights of individuals to express themselves, even if it may be considered offensive to some. Furthermore, we should also exercise our right to free speech responsibly and thoughtfully and consider the potential implications of our words and actions.","Yes, it should be of unlimited proportions. Freedom of speech should not and cannot be twisted to the point where it is no longer freedom of speech.

However, freedom of speech goes hand in hand with the idea of personal responsibility and accountability. Producing those cartoons was technically legal, but it was irresponsible. Surely the cartoonist knew that those cartoons would cause trouble in extremist countries.

However, I also think that the Islamic world is greatly overreacting. They are ruining their credibility and making themselves look like a bunch of whinging little kids who riot at the most petty insult. Do you know how many ""Jesus Christ"" parody websites exist online? How many Christians burn down embassies for stuff like that?","Yes, it should be of unlimited proportions. Freedom of speech is a fundamental right that should be respected, as it allows for a wider range of expression. While some countries may find these expressions offensive, it is important that these views are still able to be shared in order to maintain the balance between freedom and responsibility.    In addition, it is important to consider the context in which the speech occurs. Every situation is different, and thus the level of responsibility and accountability should vary depending on the circumstances. Ultimately, it is important to acknowledge that both freedom of speech and responsibility should be taken into consideration when assessing these types of situations.",Should freedom of speech be of unlimited proportions regarding religious statements?:,2
31_llama_llama_ppo_source,"I just don't know if you are referring to Latinos as a whole or to a specific group. I know that many people, born south of the USA, may speak the same way because after all Spanish is their native tongue, so when they move to speak English they may have a similar accent. Let me tell you something, not all Latinos are the same, Puerto Ricans, Cubans, Dominicans are very different from the rest of Latin America.  You don't say to an Irishman he is British, or to a Canadian he is American, or to a Basque he is Spanish. Culture shouldn't be an excuse to do something wrong, when you are allowed into another country you should learn their customs and traditions. To say that because of my culture I do this or that, is just a lame excuse to avoid responsibility.","I just don't know if you are referring to Latinos as a whole or to a specific group. I know that many people who were born in Latin American countries may have a similar accent when speaking English as they become more comfortable with the language, as Spanish is their native tongue.  However, not all Latinos are the same - Puerto Ricans, Cubans, and Dominicans have their own unique cultures which should be respected. Culture should not be used as an excuse to break rules or behave inappropriately. Everyone should take responsibility for their actions and learn about the customs and traditions of the countries they visit.  Ultimately, it is important to be aware of the differences between cultures in order to respect them.","I just don't know if you are referring Latinos as a whole or to an specific group. I know that must people that were born south of the USA, may speak the same way because after all Spanish is their native tongue, so when they move to speak English they may have sort of similar accent. Let me tell you something, not all ""Latinos"" are the same, Puerto Ricans, Cubans, Dominicans are very different to the rest of Latinamerica.  You don't say to an Irish he is British or to a Canadian he is American or to a Basque he is Spanish. Culture shouldn't be an excuse to do something wrong, when you are allowed into another country you should learn their customs and traditions. To say that because of my culture i do this or that, is just a lame excuse to avoid responsibility.","When a latino does anything, the excuse is, it's their culture. how come i can't do that? wht about my culture:",2
32_llama_ppo_source_llama,"I believe it is important to explore space as well as focus on addressing the current challenges on Earth. Although these challenges are daunting, it is important to remember that each presents an opportunity to develop innovative solutions. Additionally, working on both simultaneously allows us to maximize our chances of success while minimizing the risk that either effort is unsuccessful. Therefore, I believe that there is value in investing in both areas in order to provide the greatest likelihood of positive outcomes.","I don't think its a waste of time but i think it is pointless because our world ( Earth ) Has its own bigger problem like world poverty, population, polution, and the biggest threat...Global Warming. Which will kill 6.5 billion maybe even more people as we speak. Scientists could be foucusing on our world problems frist and try to fix those instead of trying to make other planets better to live on. What if we focus on that and near the eand we find out it is impossible to do and everyone will die because of scientist caring to much about other things when there lives also could be in stake","I don't think it's a wise use of resources to focus on exploring space instead of dealing with our own planet's more pressing issues, such as world poverty, overpopulation, pollution, and the biggest threat of all - global warming. Scientists should prioritize fixing our own problems first, before attempting to make other planets more habitable for life. If we don't succeed and everyone ends up dying, it'll be a tragic waste of resources and time.",Should explore space or focuse on earth first   stance: no we shouldn't:,2
33_source_llama_ppo_llama,"I don't think that it should be a Gov't choice...It should be the owner of the property choice....I have yet to be somewhere where smoke bothered me because most places are non smoking...bars here in Ohio aren't most anyway...and that doesn't bother me at all...maybe the next day after smelling my clothes and hair but my breath probably stinks just as bad after a night of drinks.  This is just a way of people controlling and getting money...one of the issues on the ballot if you read closely says money for the ""clean air fund""...if they band smoking why would you need a clean air fund...and what on earth are you going to do with that money?  I prefer my money to go to my child's college fund...but If this passes I won't have a choice will I?","I believe that the decision should be left up to the property owners, as this allows for a wide range of establishments to cater to their individual customer base. I have yet to be in a place where smoking bothers me as most places are now smoke-free, either by law or by choice. This gives people the freedom to decide how they want their establishments to be run, allowing them to best serve their customers. As for the clean air fund, this could be necessary to provide additional support to ensure that the law is effectively upheld. Ultimately, it is important to ensure that both smokers and non-smokers have the right to enjoy their establishments without compromise.","I believe that the choice of whether or not to allow smoking should be left up to the individual business owners, rather than the government. I've yet to be to a place where smoke has bothered me, as most establishments here in Ohio are non-smoking anyway. Bars may not be the most pleasant the next day after smelling my clothes and hair, but my breath certainly doesn't smell any worse than it does after a night of drinks. This is just another way for people to control and make money; the ballot measure is worded so that money from it will go towards the ""clean air fund"". If smoking is banned, why would we need this fund? What will they do with the money? I'd rather keep my money to put towards my child's college fund.",Smoking ban: prohibition or social engineering?:,2
34_source_llama_llama_ppo,"(pause here for deeply bitter laugh)...What an excellent question! Let's see, this is a poor woman? An immigrant? Not a middle class white woman?A woman whose family is not being torn to shreds over an agonizing decision about which they don't agree? This isn't an election year? The Shrub is in enough hot water with the public without having this situation getting the same headlines that Schiavo's case garnered? In any case, while I agree whole heartedly with your implication that the ""Culture of Life"" folks are a bunch of politically motivated hypocrites, I find that I am a little grateful that this lady was permitted to die without being at the center of a terrible storm of public controversy played out among people who don't even know her.Cold comfort, but it's all I have some days. I'm very grateful she had family with her, shame that compassion moved no one to wait for her mother.","I can understand why the ""culture of life"" Republicans are not protesting this abuse of power - this poor woman is not a middle-class white woman, she is an immigrant and her family is not being torn to shreds over an agonizing decision about which they don't agree. It is not an election year and the President is in enough hot water with the public without having this situation getting the same headlines that the Schiavo case garnered.","I am grateful that this situation was handled with respect for the woman's autonomy, allowing her to die in privacy and with dignity. While the scenario may not have garnered the same level of media attention as Schiavo's case, the differing circumstances likely meant that it was handled with more sensitivity. While it is unfortunate that this situation occurred without public outcry, it is encouraging to see that some families are able to make the difficult decisions regarding end-of-life care in a respectful manner.","Why aren't the ""culture of life"" republicans protesting this abuse of power?:",2
35_source_llama_ppo_llama,"The U.S. has one of the strongest navies in the World. We have a total of 366 military ships in commision as we speak. We have a total of 4 military ships in the area that are in danger of pirate attacks. These dangerous water cover THOUSANDS of nautical miles. So can a mere 4 ships protect this huge expanse of sea? Not effectively. So why can't the most powerful navy in the world spare a few more ships to protect the trade routes and countries around this area? Or would we rather keep the 4 ships there and hope that no more ships get hijacked? I prefer the first option.
I mean, hundreds of ships peacefully pass through the dangerous waters each day, some with the intentions to provide aid to third world countries. Is it truly politically correct to allow trade routes to be dangerous and hostile? Nope.","The U.S. has one of the strongest navies in the world and it is understandable why the US may need more ships in the piracy-infested waters. The US currently has 366 military ships in commission and 4 in the area that are vulnerable to pirate attacks. This large area of sea requires the presence of more ships in order to ensure adequate protection.  Rather than rely on 4 ships alone, it may be beneficial to deploy additional ships from the US to ensure that trade routes and coastal countries are safe. This would allow for a greater presence and ultimately provide greater security.  Ultimately, more ships may be necessary to ensure the safety of ships and crews in this area, and it is likely worth the resources to provide the extra protection.","The U.S. has one of the strongest navies in the World. We have a total of 366 military ships in commission as we speak. We have a total of 4 military ships in the area that are in danger of pirate attacks. These dangerous waters cover THOUSANDS of nautical miles. So can a mere 4 ships protect this vast expanse of sea? Not effectively. So why can't the most powerful navy in the world spare a few more ships to protect the trade routes and countries around this area? Or would we rather keep the 4 ships there and hope that no more ships get hijacked? I prefer the first option.  I mean, hundreds of ships peacefully pass through the dangerous waters each day, some with the intentions to provide aid to third world countries. Is it truly politically correct to allow trade routes to be dangerous and hostile? Nope.",Should the u.s. put more ships in the pirate infested waters?   stance: yes:,2
36_source_llama_ppo_llama,"HAHAHA! It's not going to happen.

People are free to make there own decisions in life. Yeah, maybe it sucks that there is such big consequences to it, but really you sound stupid! Sex should not be taught as an evil thing. It's not evil or dirty.  Maybe you should teach your kids about responsiblity and learn to talk to them about it. Jails are over crowded now. Imagine what it would be like if ppl are thrown into jail because of that. You can't stop nobody from doing what they want to do. You should know that already from when you where younger. The more you discouage it the more they are going to want to do it. People have that right. Yes, even kids. That's the only way they learn.","Having children learn about sex and its related consequences is important for their health and well-being. While it may be difficult to talk about, it is essential to give young people the information and guidance they need to make safe and responsible decisions. While it is understandable to want to protect children from the risks of sexual activity, banning teenage sexuality altogether is not the answer as it would prevent children from learning about sex in a safe and supportive environment.","People are free to make their own decisions in life. Yes, maybe it sucks that there are consequences to this, but really you sound unreasonable! Sex should not be taught as an evil thing. It's not evil or dirty. Maybe you should teach your kids about responsibility and communication, so that they can make informed decisions. Overcrowding in jails is a problem now, so imagine what it would be like if people were thrown in jail for just expressing themselves. You can't stop anyone from doing what they want to do. You should know that from when you were younger. The more you discourage it, the more they will want to do it. People have that right. Even teenagers. That's the only way they learn.",Why not ban teenage sexuality altogether?:,2
