id,source,rewrite_a,rewrite_b,issue,batch
70_source_llama_ppo_llama,"Depends on your state...Here in Nebraska Legal Majority age is 19. Most states it is 18, but there are special circumstances in most custody agreements that support is necessary through high school. Sounds to me like your daughter needs a swift kick in the pants! It is a very difficult thing to deal with...watching your daughter self-destruct but it sounds like you have no choice. IF she was still living with her father you should be giving him money towards her support...if she is ""on her own"" in her own apartment, you have no obligation to pay an 18yr olds rent. 
  I would tell her she is on her own...IF she wants to come home and finish High School she can...but if she wants to be a Junkie...she is on her own. She can move into the Dope mans house, get a job, or join the army. All you can do is keep a light on and pray...but you dont have to pay...","Depending on the state, 18 is the legal majority age, at which time parents are generally expected to provide financial support for their child until they reach adulthood. In most cases, this means that the parent is obligated to provide financial support for their 18 year old, even if they are living away from home and attending high school. While this can be difficult for both the parent and the child, it is generally necessary in order to ensure that the child has the necessary resources to complete their education.","Depending on the state, 18 is the legal age of majority, and parents are no longer obligated to provide financial support for their adult children. In some cases, the custody agreement may specify that support is necessary until the age of 18, but in general, parents are no longer obligated to pay for an 18 year old to live on their own. It sounds like your daughter may need a push in the right direction, and while it may be difficult to watch her self-destruct, it is important to remember that she is an adult and must take responsibility for her actions. You could suggest that she move back in with her father and take responsibility for her own support until she is able to become self-sufficient. If she chooses to stay on her own, she will need to take responsibility for the costs associated with that lifestyle. You could offer her advice, but ultimately, she is an adult and must make her own decisions.",Is a parent obligated to pay for the cost of an 18 y.o. to live on their own if in hs?:,2
71_source_llama_ppo_llama,"I understand the democratic party collects the most money from PACs. I understand as a union guy that our dues are paltry, and the teamsters and other unions supply a comparatively tiny amount of money to politicians as opposed to corporations. There is already so much undue influence by corporations that I think the ability to fund pro-union politicians would be a fine democratic check to the power of capital. When a politician wants to use legislation to curtail my right to assemble and air my grievances it reminds me of state socialist countries that do the same to their autonomous worker organizations.
","I understand the Democratic Party receives the most money from PACs, while unions tend to contribute a smaller amount when compared to corporations. However, I believe unions should be able to use PACs and Super PACs during election season in order to provide a meaningful check to the power of corporations. While I understand this can lead to greater influence for unions, I believe it is an important balance to the current system. When a politician seeks to limit unions' ability to assemble and air grievances, it can feel similar to some state-socialist countries that do the same to their worker organizations, thus underscoring the need for an even playing field during elections.","I understand the Democratic Party receives the most money from PACs. I understand as a union member that our dues are meagre, and the Teamsters and other unions provide a comparatively small amount of money to politicians as opposed to corporations. There is already so much undue influence by corporations that I believe unions should be able to fund pro-union politicians as a democratic check to the power of capital. When a politician wants to use legislation to curtail my right to assemble and air my grievances, it reminds me of state socialist countries that do the same to their autonomous worker organizations.","Cmv: i believe unions should be able to use pacs and super pacs during election season, but corporations shouldn't.:",2
72_source_llama_ppo_llama,"FOUNDER IS NOT A PERSON WHO ""DISCOVERS"" A PLACE if so i can say the prince Sanila Utama is the founder of singapore!(this for some who say farquhar saw the island first) And I do know that farquer has been very involved in this help and sometimes even does all the work but let me remind you that being raffles ""assistant"" he still had to consult raffles and raffles had all authority over Singapore therefore he was given credit. Then i would like to ask u a question why then does the names ""raffles institution"" ""raffles hospital"" raffles medical clinics""","FOUNDERS ARE PEOPLE WHO ARE RESPONSIBLE FOR THE FOUNDING OF A PLACE, regardless of when it is discovered. While Farquhar was influential in the establishment of Singapore, Raffles still had authority over the island, and thus has the most credit for its founding.  It is true that Farquhar had a major role in the development of Singapore, but without Raffles' guidance and authorization, the island may not have been established at all. Therefore, Raffles is ultimately credited with founding Singapore.","Farquhar should be honoured as the rightful founder of Singapore since he had an integral role in establishing the settlement and playing an important part in its development. He was second-in-command to Thomas Stamford Raffles, who is usually credited as the founder of Singapore, and was involved in helping to develop the infrastructure, administration and government of the settlement.",William farquhar ought to be honoured as the rightful founder of singapore:,2
73_llama_llama_ppo_source,"Excuse me! That's quite an aggressive statement. I'm a 17 year old student, recently joined the army reserves and have straight A's. I'm not a retard, which is a very rude thing to say. Retardation is an unfortunate occurrence and there are actual retards out there. I'm also not a lazy fat ass, as I'm very active and athletic. Thank you very much!","EXCUSE ME! While some people may be more adept than others at using online forums, it is unfair to generalize and suggest that people may have dropped out of school or are lazy and fat. Everyone is different and has different levels of dedication and capabilities. It is possible to be an accomplished student while still being active on online forums.    In conclusion, while people may have different capabilities and levels of activity, it is unwise to jump to conclusions about someone's educational history or level of fitness. Everyone is unique and should be respected as such.","EXCUSE ME! wow someone is very agressive...me? nah I tell the truth...17 years old...very athletic...joined the army reserves recently and I'm a straight A student who might occaisonally recieve a B+...so I'm not retarded, which I think accusing people of being retards is a very rude thing to say because retardation is an unfortunaste thing to happen to any person and there are actual retards out there, and I'm entering my senior year of high school meaning i haven't dropped out...and since I'm active and very athletic I'm not a lazy fat ass...thank you very much!","Clarification: people who post on here are simply freaking retards that dropped out of school, and are now lazy fat asses who spend all their time posing as 16 year old boys over the internet.   stance: no, people aren't pediphiles but still lazy fat asses:",2
74_llama_ppo_source_llama,"I believe that professional soccer players should receive some sort of penalty when they over exaggerate injuries. It can be difficult to decipher between legitimate injuries and exaggerated ones, which can give a poor image to the sport overall. In football, basketball, and other sports, players are able to brush off the bump and go back into the game without receiving a yellow card, which is effective in punishing any foul while also allowing the player to remain in the game. This can provide a good balance between punishing offenses and allowing players to remain in the game.","I think the pusillanimous behavior of professional soccer players playing up a slight bump by a member of the opposing team is unsportsmanlike and gives a poor image to the sport overall. It seems as though the player who was one moment ago crying out in agony is nearly always up running around after the other guy receives a yellow card (presumably because the first guy just received an almost death blow). If you look at football, basketball, etc., the players always brush off the bump and go right back into the game. 

Of course, I'm not saying that legit injuries don't occur, or that fouls shouldn't be punished. I'm simply saying that soccer is full of fakers and it pisses me off. Change my view.","I believe that professional soccer players should not be able to get away with over-exaggerating injuries so easily. They should be penalized in some way for their pusillanimous behavior. If they are able to brush off minor bumps in other sports, then why do they need to act so dramatically in soccer? It does not give a good image to the sport, and it should not be tolerated. A yellow card is a suitable punishment for such malicious behavior.",Cmv:i think professional soccer players who over exaggerate injuries should receive a yellow card.:,2
75_llama_ppo_source_llama,"I believe that people should have the right to explore their own consciousness, as long as it is done in a safe and responsible way. Laws should exist to ensure that psychedelic drugs are used safely, while also recognizing the potential benefits they can bring. Studies have indicated that psychedelics, such as psilocybin (shrooms) and LSD, while potentially beneficial, are not as harmful as other drugs such as alcohol and tobacco. They are not addictive either, making them an appropriate choice for those willing to use them.  While some drugs such as nBOMe’s should remain illegal, it is important to recognize that not all psychedelics are created equally and should be treated with caution.","I feel that people should have the right to explore their own consciousness as long as it doesn't hurt anyone else in the process. Obviously similar laws to alcohol should exist, where you can't be tripping in public &amp; such. As more and more research continues, scientists are finding that psychedelics such as Psilocybin (Shrooms) and LSD are pretty harmful as far as drugs go, Especially compared to legal substances such as Alcohol and Tobacco. Psychedelics also aren't addictive either. I feel that if all these drugs do is often improve the users quality of life, and they aren't addictive or proven to be mentally or physically harmful, then I don't see why they should be illegal.

Obviously when I say ""psychedelics"" I'm referring to the ones that are as I described: harmless and non-addictive. Psychedelics such as nBOMe's and other ones that may be harmful should not be legalized.","I believe that people should have the right to explore their own consciousness without fear of legal repercussions as long as they are not causing harm to others. Research has shown that substances such as psilocybin (“shrooms”) and LSD are less harmful than other drugs, such as alcohol and tobacco. They are also not addictive. Given that these drugs are largely harmless and do not appear to have any lasting physical or mental health effects, I believe that they should be legalized.",Cmv: i believe that most psychedelic drugs should be legal:,2
76_llama_llama_ppo_source,"If that is the entire story then that outcome is completely bogus. There is NOTHING wrong with touching another person on the head, shoulder, leg, back, etc. There is only something wrong when a person touches a “bad” place, which CLEARLY was not happening and was not going to happen in the middle of the street.   What should have happened? The parents should have gotten a lecture on teaching their daughter. The daughter should have gotten a lecture on not running into the street. And the man should have gotten a lecture on smartening up in our lawsuit and sex-crime crazed society. There was no need for any trials or arrests.   And how is someone who was NOT CONVICTED (ie: innocent) of a crime forced to register as a sex offender? That simply doesn't make any sense at all.","If that was the entire story, then it was unfortunate that an arrest was made as it may have caused unnecessary distress and anxiety for all involved. It is important to consider all the facts of the case and not just a single incident. The outcome could have been negotiated in such a way that both the parent and the child received appropriate advice and support, as well as learning the importance of maintaining safety in different environments. In this way, everyone would have benefited from the experience.","If that is the entire story then that outcome is completely bogus. There is NOTHING wrong with touching another person on the head, shoulder, leg, back, etc. There is only something wrong when a person touches a ""bad"" place, which CLEARLY was not happening and was not going to happen in the middle of the street. 

What should have happened? The parents should have gotten a lecture on teaching their daughter. The daughter should have gotten a lecture on not running into the street. And the man should have gotten a lecture on smartening up in our lawsuit and sex-crime crazed society. There was no need for any trials or arrests. 

And how is someone who was NOT CONVICTED (ie: innocent) of a crime forced to register as a sex offender? That simply doesn't make any sense at all.","What do you think of this situation, i read it and i didn't agree with the outcome...?:",2
77_llama_llama_ppo_source,"How do you think we got our freedom by standing back? In the public eye, Iraq does not deserve freedom like ours. We need to keep fighting the terrorists for the people of the world from the terrorists who rule it. And we are not dictators, we are freedom fighters who fight for freedom, justice, and liberty. Unfortunately, people lost sight of it, and voted wrong yesterday. Morally, we are now also headed in the wrong direction. People need to be responsible for their actions and not blame it on science or society. Finally, for the budget, there goes the state and national level budget and economy, and our taxes. People want things to be in place for a better country and community, but who do you think we pay for it in the long run? We do with our taxes, not with the so-called federal and state money people think we have. Country is in a mess, thanks to the ungrateful American public who forget how our free nation was founded and maintained.","How do I think we obtained our freedom by standing back? Through hard work, bravery, and sacrifice, our military was able to provide us with the freedom that we have today. In the public eye, Iraq does not deserve freedom in the same way that we have it, however, this does not mean that we should abandon them as a country. We must remain engaged in order to ensure that stability and freedom are maintained in the region. Without continued effort from all countries involved, peace may be difficult to achieve in these areas. This requires a collective effort from all countries to ensure stability and peace in other countries.","how do you think we got our freedom by standing back.

in the public eyes iraq does not deserve freedom like ours.  we need keep fighting the terrorist for the people OF THE WORLD from the terrorist who rule it.  and we are not dictator we are freedom fighters who fight for FREEDOM,  JUSTICE AND LIBERTY.  unfortunitly people lost sight of it  and voted wrong yesterday.  

and morally we are now also headed in the wrong direction.  people need to be responible for their action and not blame it on science or the society.

finally for the budget there goes the state and national level budget and economy and our taxes.  people what things to be in place for a better country and community.  but who do you think we pay for it in the long run.  we do with our taxes, not with the so called federal and state money people think we have.

 country is in a mess thanks to the ungrateful american public who forget how our free",If  u s   can not  make peace   in other  countries?:,2
78_source_llama_llama_ppo,"Definately, the egg and spoon race is a wicked idea! And maybe we should have the royal family breed up a few more uinterbred little kids to partake in the warfare. Imagine them up against the vodka drinking russians.
I reckon there would be <if there were no ewapons> less control over the masses - wich has to be a good thing. And there would simply be calm and not so calm areas of the world. There'd be little communes, and then gang rivaled cities. But at least all the fighting nobheads would kill themselves in one place, and the sophisticated calm people wouldn't have to pay for it.","Definitely, the egg and spoon race is a wicked idea! And maybe we should have the royal family breed up a few more un-privileged little kids to partake in the warfare. Imagine them up against the vodka drinking Russians. I reckon there would be less control over the masses - which has to be a good thing. And there would simply be calm and not so calm areas of the world. There'd be little communes, and then gang-ridden cities. But at least all the fighting nobheads would kill themselves in one place, and the sophisticated calm people wouldn't have to pay for it.","Definitely, the universal soldier/bomb maker would reduce the occurrence of war as it would limit the amount of destruction caused by weapons. Without the access to advanced weaponry, there would be less control over the masses - which is a good thing. There would simply be calm and less-cral areas of the world, with fewer casualties and less property damage. This can only be beneficial in the long run.",If it wasn't for the universal soldier/bomb maker would there never be another war?:,2
79_llama_ppo_source_llama,"Gay marriage is a valid lifestyle choice and should be accepted by society, as it is a way for individuals to express their love and commitment to one another. Although it may make some people uncomfortable, it is a right that should be respected as it allows couples to have the same rights and protections as other married couples. Everyone should be afforded the same respect and understanding, regardless of their sexual orientation.","Gay marriage is a lifestyle choice. It may be considered ""unnatural"", but that is between that person and his/her love interest. Love is all some people have... You can't take that one given right away because it makes you uncomfortable. They want acceptance and understanding. Let them be happy or just ignore it. You don't chose to be gay either. Who would chose to live that way? They are constantly being harrassed and can't be with their loved one. It's unfortunate and cruel. Please be respecful of them. They have done nothing wrong, God created them that way. 3","Gay marriage is a lifestyle choice. It may be considered “unnatural”, but that is between that person and their partner. Love is all some people have in this world, and it is unfair to take that away from them just because it makes you uncomfortable. They want acceptance and understanding, not judgement and rejection. Let them be happy or just ignore it. You don't choose to be gay either. Who would choose to live that way? They are constantly being harrassed and discriminated against, and cannot be with their loved one. It is unfair and cruel. Respect their rights, and be tolerant and understanding of their differences. God created them that way, after all.",Gay marriage right or wrong:,2
80_llama_source_llama_ppo,"It's better to have an imperfect father for practical reasons. You can blame every mistake you've made on your father and he won't pry into your business or search your room. He won't be too overbearing and will allow you some independence. He might get angry at your forgetfulness, but he won't put a hole in your backpack or take away your possessions like a truly abusive father would. In some ways, he's still a lousy father, but he's better than being fatherless.",It's better to have a lousy father for practical reasons. You can blame every mistake you've made on your father. He won't pry into your business and search your room and take your stuff because he doesnt think I need it. He wouldnt care so much that he would get pissed and throw my backpack with my computer in it at a wall putting a hole in it because I didn't clean the sink after breakfast or I forgot my keys. I think it's actually an opinion because that kind of father is still lousy because he'll tell you that he hates you and I ruined his life.,"Having a bad father can be difficult, as it can lead to a lasting impact on the child. However, having no father at all can be just as difficult as it can lead to a child feeling a sense of abandonment and loss. Therefore, while it may be better to have a lousy father for practical reasons, it can still be very traumatic for the child and have lasting effects.",Is it better to have a lousy father or to be fatherless:,2
81_llama_ppo_source_llama,"CarCraze - while the court does have the power to issue a motion to collect a debt, it is important to understand the implications of this. A motion to collect a debt can be intimidating and it is important to take the appropriate steps to ensure that you are aware of the options available to you. In this case, it is wise to seek legal counsel to explore your options and ensure that you make a decision that is suitable for your situation. It is important to understand the terms of the court order, how it may affect you, and what steps you can take to take the best course of action.  It is important to understand the implications of such a court order, and to ensure that you understand all of your available options.","CarCraze --- you are wrong, sorry to say

What you have there, my dear, is a bona fide Court Order for you to appear in court to answer to a Motion to Collect a Debt. If it is on Court paper and has a case number, call the Court to confirm the Docket Number, and find out when the hearing date is.


YES, they do have that power.

YES, That is the equivalent of a Subpoena.

If you ""just let it ride"", as you say, don't be surprised when you open up your paycheck and you find a good chunk of it GONE !

What you should do:

Seek legal counsel (get a lawyer) and come up with a manageable payment plan that is both satisfactory to your creditor, and workable for you.

DON'T HESITATE - you will regret it.","CarCraze - You are incorrect in stating that the collection firm does not have the power to amend their notice of motion. As a matter of fact, the collection firm does have that power. Furthermore, their amended notice of motion is a legally binding court order and is equivalent to a subpoena, indicating that you are required to appear in court to answer the motion to collect a debt. If you choose to ignore the order, you may be subject to severe penalties and may be ordered to pay a fine. Therefore, it is in your best interest to seek legal counsel (get a lawyer) and come up with a manageable payment plan that is satisfactory to your creditor and workable for you. Do not hesitate, as you will surely regret it.",Amended notice of motion from a collection firm?:,2
