id,source,rewrite_a,rewrite_b,issue,batch
1_llama_ppo_llama_source,"Porn can be a slippery slope and can lead to negative consequences such as feelings of guilt, wasted time and energy, and regrets. While it may provide a realistic view of sexual activity, it is important to consider the potential risks before engaging in it. Therefore, it is best to exercise caution and be mindful of the possible risks involved.","The argument that porn would expose one to the reality in life, and thus increasing one's maturity and preventing possible future sexual assaults, is not valid. Porn is definitely wrong. After a dosage, the guilt of wasting one's time, energy, and effort will almost kill you. Trust me. It's a road that should not be taken, it's as bad as smoking and drugs. I think the only reason it is not banned in most developed countries is that they are facing an aging population.","The argument that porn would expose one to the reality in life, and thus increasing one's maturity and prevent possible future sexual assaults, is totally crap.
porn is definitely wrong. after a dosage, the guilt of wasting ur time, wasting energy, wasting effort and not devoting urself to another thing and regretting that you should not have started would almost kill you. trust me.
its a road that shld not be taken, its as bad as smoking and dugs. i think the only reason its not banned in most developed countries is that they are facing an aging population.",Is porn wrong:,2
2_llama_ppo_llama_source,"No, I haven't but it sounds like she may be able to access assistance through pro bono legal services or low income-based legal services. You would be surprised at what some places consider low income - my sister's husband earns a weekly income of $400-$600 in the winter and $600 in the summer, which is enough to bring home approximately $46,000 a year. This income level enables them to access assistance from WIC, daycare subsidies and other support. She may be able to access some of these services, so it is worth investigating.","No, I haven't but it sounds like it might be a friend in need. There may be help available through pro-bono services or low income based legal services that she could take advantage of. You'd be surprised at what some places consider low income. My sister's husband brings home at least $400 a week in winter and at least $600 a week in summer, and they have a three-person household. They earn approximately $46,000 a year and receive help from WIC, daycare assistance, food stamps, and more. Tell her to look into these services.","No I haven't but (it sounds like its a friend) and it sounds like she can get help through a pro-bono place , or a low income based legal services . YOU WOULD BE SURPRISED  at what some places consider LOW INCOME . My sisters husband brings home at least $400.00 a wk (in winter) and at least $600.00 a wk. in summer , and they have a 3 person household . They get approx. $46,000 a year bring home and they get help from W.I.C , Daycare Asst. , food excetra . So tell her - or help her , find those services .",Have you lost your children to rich husband?:,2
3_source_llama_llama_ppo,"Sadism as the practice of violence or cruelty against others to fulfil some sort of personal or sexual gratification is, in my opinion, the most sickening act a person can commit. In order to commit such an act, the person must be subjugated and therefore weaker than the active participant, thus compounding the act of violence. This is ""evil"".
However where both, or all individuals are consenting active participants, I believe this to be a form of masochism, albeit from the hands of another. Although this statement may seem to be an oxymoron, if you pursue pain and violence, and consequently receive it from the hands of another, is this not just ""assisted"" masochism? (a la assisted suicide) Although these individuals may be strange, what two (or more) consenting adults do in private is no concern of mine.
Pick this apart at your will.","Sadism as the practice of violence or cruelty against others to fulfil some sort of personal or sexual gratification is, in my opinion, the most sickening act a person can commit. In order to commit such an act, the person must be subjugated and therefore weaker than the active participant, thus compounding the act of violence. This is ""evil"".  However, where both, or all individuals are consenting active participants, I believe this to be a form of masochism, albeit from the hands of another. Although this statement may seem to be an oxymoron, if you pursue pain and violence, and consequently receive it from the hands of another, is this not just ""assisted"" masochism? (a la assisted suicide) Although these individuals may be strange, what two (or more) consenting adults do in private is no concern of mine. Pick this apart at your will.","Sadism, in which one person derives pleasure from inflicting pain and suffering on another, is an extreme and serious form of violence which can have significant and long-lasting psychological and physical effects on victims. While some acts of sadism may occur between consenting adults, it is still an abhorrent act that can cause immense harm, regardless of the participants’ level of consent. It is important to recognise that these acts can occur within a sexual context and can have serious and long-lasting consequences.",Sadism is the most evil thing a human can indulge in.   stance: yes:,2
4_llama_source_llama_ppo,"I believe that investing in research to create hybrid animals has the potential to be immensely beneficial, both financially and scientifically. For example, creating a half gorilla-half octopus could result in an incredibly powerful animal with two legs and six waving arms, as well as a furry face. While it is true that creating such creatures might cost a lot and might hurt some animals, I believe the outcome would make it all worthwhile. Imagine being able to have a turtle with a chicken head wandering around your house - it would certainly be a unique pet!  Thus, I do not believe the ""don't play god"" argument holds much weight, as I am confident the results of such research would be incredible.","I think we should be putting millions into research of doing cool animal combinations.  For example: a half gorilla half octopus.  Face is similar to an octopus and has 2 legs and 6 wavy arms and its also furry.

I don't buy the ""don't play god"" argument because I'm not worried about god smiting us for creating abominations.

Imagine if you could have a turtle with a chicken head just wandering about your house.

Sure the research would cost a lot and some animals might get hurt but I really feel the end result would be worth it.","I think research into combining animals could be beneficial and worth the cost. For example, a gorilla/octopus hybrid could offer unique characteristics from both parent species, and it could be an exciting and interesting creature to observe. While the potential risk of harming animals should be taken into consideration, the potential benefits of creating these combinations could also be worth it.",Cmv: i think we should be actively trying to combine animals to make cooler animals:,2
5_source_llama_ppo_llama,"Thats just liberal ignorance. A criminal will find a way, be it a gun, knife, baseball bat...It's just ""feel good"" legislation. Makes the liberals think they are doing something to combat crime (while letting the criminals run rampant)

Statistics show that criminals do less when up against a well-armed citizen. (And crime rates drop). And for the record, the second amendment is there, not to protect our hunting rights, but to allow us to have the ability to fight back against a governement that goes out of control. And hunting rifles against machine guns isn't an even matchup.","Gun control can be an effective way to reduce crime as it limits access to firearms for potential criminals. While some may argue that criminals will find other weapons, statistics show that gun control does reduce crime rates as criminals are less likely to engage in criminal activity when up against an armed citizen. This suggests that gun control can be an effective method to protect citizens and reduce crime.  In addition, the Second Amendment was incorporated to the states to allow citizens to bear arms in order to provide a check against a potential tyrannical government. Thus, gun control can provide an important layer of safety that should not be overlooked.","That's just stereotypical thinking. A criminal will find a way, be it a gun, knife, baseball bat, or some other object. It's not helpful to enact ""feel good"" legislation that makes liberals feel like they're doing something to combat crime while letting the criminals run rampant. Statistics show that when a well-armed citizen is present, criminal activity lessens and crime rates drop. Additionally, the Second Amendment exists to guarantee the citizenry the right to bear arms and provide the ability to resist an overreaching government. A hunting rifle is hardly a match for a machine gun.",Gun control?:,2
6_llama_ppo_llama_source,"Being horny is a natural feeling, and while it may create a temptation to engage in certain activities, it does not make the activities themselves wrong. Teaching young people about morality can be difficult without a shared understanding of right and wrong, which is why it is important to provide a base of knowledge and education which allows individuals to make informed decisions. Religion can be a powerful influence in teaching morals, and it is important to recognize the different beliefs and values of different cultures when discussing these topics.","Being horny is a sin.  Wanking is a sin.  Having sex with your girlfriend is not wrong.  Raping is not wrong either, but putting the two in the same context of a “sin” is causing confusion and potentially leading to such acts.  We should teach morals, not religion, to young men so that they can have a clear understanding of what is right and wrong.","Being horny is a sin.

Wanking is a sin

Having sex with your girlfriend is a sin

Raping is a sin

If this is what young men are taught, how can they have an concept of what wrong and right actually are. 
We should teach morals not religion.

Religion teaches natural feelings are wrong. You don't tell a woman feeling cold is wrong so why tell a man acting on hornyness is wrong? I'm not say rape is right just that consential sex with a girlfirend is not wrong and putting the two in the same context of a 'sin' is causing rape.",Cmv believing in 'sin' is the reason rape is high in the middle east and asia.:,2
7_llama_ppo_llama_source,"In a society that is traditionally and, to be honest, still patriarchal, lesbians may experience less stigma and discrimination than gay men due to the presence of a woman in the relationship. This is because, in the traditional gender dynamics, women are seen as inferior to men. Thus, lesbians may be more accepted by straight people than gay men. This is likely due to the societal expectation that a woman’s romantic interest should be for another woman rather than a man. Gay men, however, often face discrimination due to the societal expectation that men should be interested in women. Thus, gay men can experience more discrimination than lesbians.","In a society traditionally and, to be honest, still dominated by men, men's general consensus is more popular than women's general consensus, and I think we all know that a lot of men consider lesbians to be downright sexy, because there is no man in the picture to ruin the aesthetic.  (Vice versa for gay men.)  Additionally, gay women are more ""socially acceptable,"" for one of the traditional reasons behind homophobia: women are inferior to men.  Gay men are discriminated against because they have no honor: romantic interest in men is for women only, and when an man participates he is ""lowering himself"" to a women's level.  Gay women, on the other hand, are discriminated against less because romantic interest in women is a man's attribute, giving them honor.","In a society traditionally and, to be honest, still dominated by men, men's general consensus is more popular than women's general consensus, and I think we all know that a lot of men consider lesbians to be downright sexy, because there is no man in the picture to ruin the aesthetic. (Vice versa for gay men.)
Additionally, gay women are more ""socially acceptable,"" for one of the traditional reasons behind homophobia: women are inferior to men.
Gay men are discriminated against because they have no honor: romantic interest in men is for women only, and when an man participates he is ""lowering himself"" to a women's level.
Gay women, on the other hand, are discriminated against less because romantic interest in women is a man's attribute, giving them honor.
(The preceding is not my opinion, but instead my rather cynical interpretation of modern society)",Do lesbians have it easier than gay men??   stance: lesbians are more socially accepted by straight people:,2
8_llama_llama_ppo_source,"This guy's actually got a point. I'm not so sure on the specifics of any Yahoo involvement, but I do know for certain that the Chinese government is very oppressive to anyone who questions its motives or policies. Instances of beatings and torture are still a regular part of protocol there. America simply chooses to ignore it because we're more concerned with preserving our good economic relations with China, even though a lot of the cheap labor we outsource there is indeed done by slaves. We really should wake up and start seeing the truth.","This is a sensitive topic that requires careful consideration. While it is true that the Chinese government can be oppressive to those who question its policies, it is important to consider the potential implications of interfering in its affairs. The United States may have reasons for avoiding direct involvement in the country, and it is essential to understand both sides of the story in order to reach an informed opinion.","This guy's actually got a point. I'm not so sure on the specifics of any yahoo involvement, but I do know for certain that the Chinese government is very oppressive to anyone who questions its motives or policies. Instances may have tailed off over recent years, but beatings and torture are still a regular part of protocol there. America simply chooses to ignore it because we're more concerned with preserving our good economic relations with China, even though a lot of the cheap labor we outsource there is indeed done by slaves. We really should wake up and start seeing the truth.",Yea so i'm really drunk right now and i have a question.?:,2
9_llama_ppo_llama_source,"I agree that it was not ethical and was even insensitive, but they were done in response to the suicide bombers and they certainly don't respect others beliefs and truths. We can never know the full story behind the cartoons and the reactions to them, but it is important to remember that both sides can be affected by these situations, regardless of the cause. While both sides are equally upset, it is important that we do not lose sight of the fact that all lives should be respected and not just the Muslims specifically.","I agree that it was not ethical and was even insensitive, but they were done in response to the suicide bombers and they certainly don't respect others beliefs and truths...what is the difference?","nuitsen I agree that it was not ethical and was even insensitive, but they were done in response to the suicide bombers and they certainly don't respect others beliefs and truths....what is the difference?

s_s2
You do not see all the people (muslims) who are not suicide bombers protesting about the suicide bombers when Islam, so we are told, is a peaceful religion. It is the suicide bombers who have no respect for others beliefs...they are even killing fellow Muslims in Iraq but I don't see anybody protesting about that. 
I was referring to the suicide bombers and not Muslims as a whole.

Melliare?",Denmark caricatures?:,2
10_llama_llama_ppo_source,"You can be a kind, compassionate person and bad things will still happen to you. Conversely you can go through life being a selfish asshole and still be successful. People in life who are successful are usually successful because they took what they wanted and played to win. Often, those who take risks and play aggressively get ahead while those who do right by others but don't take risks or push for what they want don't get as far. This is not fair, but it's the way the world works. One should not give up on kindness and fairness, but be aware that in life, one may have to take risks and take charge in order to get ahead.  In the end, life is not fair, but it is important to learn from one's experiences and be prepared to take risks if one wants to get ahead.","Life can be difficult and unpredictable, and it is important to prepare for the unexpected. While it may be true that some people take risks and are willing to take the necessary steps to be successful, there is no guarantee of success regardless of how one approaches life. Everyone should strive to take risks and do their best, as different experiences and outcomes can arise depending on an individual's circumstances.","You can be a kind, compassionate person and bad shit will still happen to you. Conversely you can go through life being a selfish asshole and still be successful. People in life who are successful are usually successful because they took what they wanted and played to win. 

I see it everywhere, employers or bosses that treat some stuff like shit but are financially successful. People who do right by other people sometimes but get nothing in return.

I dont like it, but I see it often. If life were fair, inncocent people would not goto prison, hard working people would get ahead, good people would not be poor. ","Cmv: life is not fair, and it is an important lesson to learn:",2
11_source_llama_ppo_llama,"Scott Peterson was the white juxtapostion to OJ. He wasn't a celebrity, he was an ""everyman."" Like OJ, he killed the mother of his children. The similarities stop there. He and Laci, were nice looking so the TV images were good. We watched it for the same reason we watched Michael Douglas and Glen Close in Fatal Attraction. Scott is just an average white guy. As with most people who have an affair, particularly when the wife is at home pregnant, his version of reality went off the reservation. It was a warning sign to the rest of us. 1) Don't lose sight of reality and think that life will be great after you kill your pregnant wife and hook up with the psycho-chic who was f**king you while your wife was pregnant. 2) If you are an average white guy, you do not get off for a crime like OJ got off. It still seems that a black celebrity can work his celebrity magic on a jury - right Michael?","Scott Peterson's case received a lot of media attention primarily because of the similarities between his case and that of O.J. Simpson’s. Both cases featured a white defendant, a crime involving a death of a pregnant wife and an accomplice. The public was highly interested in the outcome of both trials due to the sensational nature of the cases. Furthermore, the media attention provided greater insight into the legal proceedings, allowing the public to better understand the differences and similarities between the two cases.","Scott Peterson was the antithesis to OJ. He wasn't a celebrity, he was an everyday person. Like OJ, he killed the mother of his children. The similarities stop there. He and Laci, were good-looking people, so the TV images were appealing. We watched it for the same reasons we watched Michael Douglas and Glenn Close in Fatal Attraction. Scott is just an average everyday white guy. As with most people who have an affair, particularly when the wife is home pregnant, his version of reality went awry. It was a warning sign to the rest of us.  1) Don't lose sight of reality and think that life will be great after you kill your pregnant wife and hook up with the psycho-chic who was f*cking you while your wife was pregnant.   2) If you're an average everyday white guy, you won't get off scott free like OJ got away with it. It still seems that a black celebrity can work their celebrity magic on a jury - right Michael?",Why did the scott peterson case get so much media attention?:,2
12_source_llama_ppo_llama,"* Hamas has fired some 2000 missiles into Israel over the past 2 weeks despite numerous attempts by Israel to cease-fire without retaliation.

* Hamas declining/ignoring these opportunities of peace have left Israel with no options besides retaliation. With the main goal of Hamas being to destroy Israel; Israel has the right to neutralize Hamas to ensure the safety of Israeli citizens.

* Israel should not be held accountable for civilian casualties in Gaza when Hamas is actively trying to increase civilian casualties by firing missiles out of civilian buildings.

* I believe the disregard for civilian casualties by Hamas and continual bombing of Israel is enough justification to invade Gaza and prevent further bombings.","* Hamas has launched hundreds of missiles into Israel over the past two weeks, despite numerous ceasefire attempts from Israel. This aggression leaves Israel with limited options to protect its citizens and ensure security.   * Hamas’ aim of completely destroying Israel makes it clear that Israel has the right to defend itself in order to guarantee the safety of its citizens. Israel must be allowed to take action to minimize civilian casualties caused by Hamas, while still effectively targeting the group’s attacks.   * While Israel must be allowed the right to protect its citizens, the deliberate targeting of civilians by Hamas is equally as concerning and must be addressed. Both sides must ensure that civilians are protected, and Israel must be able to take the necessary steps to do so.","Israel has every right to retaliate against Hamas for the hundreds of missiles that have been fired into Israel over the past two weeks despite numerous attempts by Israel to secure a cease-fire. Hamas's refusal to accept a peaceful resolution has left Israel with no choice but to take action to protect its citizens. Additionally, Hamas' goal of destroying Israel means that neutralizing the group is essential for ensuring the safety of Israelis. Israel should not be held accountable for civilian casualties in Gaza when Hamas is actively using civilians as human shields by firing missiles from within civilian buildings. Finally, the invasion of Gaza is necessary to prevent further attacks on Israel.",Cmv: hamas is nothing short of a terrorist organization and israel has every right to retaliate.:,2
13_llama_llama_ppo_source,"This debate has clarified for me that the government shouldn't really be in the marriage business.  Let the churches perform marriages for whomever they think fit, and let the government simply record the marriages or civil unions and grant equal rights to them all.  As for plural ""marriages,""  they exist, but there is not a sizable part of the population which supports them.  That is a different debate for another day, and the issues are quite different.  In my mind, the purpose of marriage or civil union is to provide support to individuals, especially when they are raising children.  Some of the most committed couples I know are gay, and they are some of the best parents too.","This debate has clarified for me that the government should not play a role in defining or restricting who can marry. Instead, I believe that churches should be allowed to perform marriages for whomever they deem fit and the government should merely record the marriages or civil unions and grant equal rights to all. With regards to plural marriages, these are rare but do exist. This is an issue that deserves more attention and should be discussed further as it is different from same-sex marriage. In my opinion, the purpose of marriage or civil union should be to provide security to families, especially when they are raising children. Some of the most monogamous couples I know are gay and they are some of the best parents as well.","This debate has clarified for me that the government shouldn't really be in the marriage business.  Let the churches perform marriages for whomever they think fit, and let the government simply record the marraiges or civil unions and grant equal rights to them all.  As for plural ""marriages,""  they exist, but there is not a sizable part of the population which supports them.  That is a different debate for another day, and the issues are quite different.  In my mind, the purpose of marriage or civil union is to provide support to individuals, especially when they are raising children.  Some of the most monogamous couples I know are gay, and they are some of the best parents too.",Should same sex marriages be legal?:,2
