id,source,rewrite_a,rewrite_b,issue,batch
48_source_llama_ppo_llama,"There is no provision in either document you cite which says keeping all the fruits of our earnings is a part of freedom.

Now, our founding fathers were involved in colony govts before they were involved in rebellion.  In Virginia, our house of burgesses provided money every year to every widow and orphan.  We also applied our tax money to construction projects for the common good.  We also had courts to help protect our rights.  

When we had our revolution, we were opposed to taxation WITHOUT representation, we were not opposed to taxation.  We never have been.

You have a pretty limited view of humanity and our responsibility to create a just society.   Plus, you seem to be basing it on parts of our founding documents which don't exist.","There is no provision in either document you cite which states that taxation should be imposed without consent of the people. While it is true that the Founding Fathers were involved in colonial governments prior to the Revolution, these governments were largely under British rule and subject to their taxation systems. Our Founding Fathers were ultimately opposed to the concept of taxation without representation and sought to ensure that the new nation was able to raise revenue in a more fair and equitable way. This necessitated the adoption of a constitution which outlined specific powers to the federal government and provided a mechanism for taxation to occur within those parameters.  It is also important to remember that while the Constitution specifically outlines the taxation process, it also outlines the process for collecting it, which is typically done by the federal government. Despite the unconstitutionality of some taxation systems, the federal government is still able to enforce them as it has the necessary power granted to it by the Constitution.","There is no provision in either document you cite which says that keeping all the fruits of our earnings is a part of freedom.   Now, our founding fathers were involved in colony governments before they were involved in rebellion. In Virginia, our house of burgesses provided money every year to every widow and orphan. We also applied our tax money to construction projects for the common good. We also had courts to help protect our rights.   When we had our revolution, we were opposed to taxation without representation, we were not opposed to taxation. We never have been.   You have a pretty limited view of humanity and our responsibility to create a just society. Plus, you seem to be basing it on parts of our founding documents which don't exist.",Should there be an income tax? how is it enforced despite the fact that it's unconstitutional?:,2
49_source_llama_ppo_llama,"Ethically, it's not okay for anyone to invade the privacy of an innocent person.  It's stupid and potentially dangerous to stalk celebrities, and many suits have been brought against various photographers and publications.  However, we have the right to know what the government is doing-- because it's with our money.  Governments steal from us, then use the fruits of their theft against us.
Anyone arguing that the 4th Amendment protects our privacy from the government is living under a rock.  The 4th has been effectively nullified by SSNs, gun records, increasing search & seizure to look for a ""probable cause"", phone tapping, and the fact that the government is so vast and powerful that businesses are being forced to collude with bureaucrats and hand over what little privacy we had left.","Ethically, it is important to protect an individual's privacy regardless of the actor. While it can be understandable why the public may want to know certain information, the invasion of an individual's privacy can be invasive and should be done with caution. In terms of governmental and private citizens' invasion of privacy, the right balance should be found to protect the individual's privacy while also allowing access to information when needed.","Ethically, it's not okay for anyone to invade the privacy of an innocent person. It's stupid and potentially dangerous to stalk celebrities, and many suits have been brought against various photographers and publications. However, we have the right to know what the government is doing—because it’s with our money. Governments steal from us, then use the fruits of their theft against us. Any argument that the Fourth Amendment protects our privacy from the government is naive—the Fourth Amendment has been effectively nullified by Social Security Numbers, gun records, increasing search and seizure to look for a “probable cause,” phone tapping, and the vast, powerful nature of the government.","Why is it ok for the media to invade people's privacy, but not ok the government or private citizens do?:",2
50_llama_ppo_source_llama,"It has been proven to the satisfaction of many people, but there are some that are extremely difficult to convince. This is primarily due to their faith in the government and a lack of willingness to believe that their government could be involved in such a tragedy. This could potentially be the case in the future, but until then it is important to remain vigilant and continue to investigate the events of 9/11.","It has been proven to the satisfaction of many people, but there are some that are extremely hard to convince, for a variety of reasons. These reasons are mainly faith based, in that they have faith in the government, and do not want to believe that their government could murder three thousand of its own citizens. They will all wake up in due time, probably when the country is under Martial law, with curfews imposed, and they become prisoners in their own house.
That's for the lucky ones of course. The less lucky will become prisoners in the 600 or so concentration camps which have been built around the country, and are already manned and waiting for their presence.","It has been proven to the satisfaction of many people, but there are some that are extremely hard to convince, for a variety of reasons. These reasons are mainly based on faith in the government, and a desire to not believe that their government could carry out a massacre of its own citizens. Unfortunately, it is likely that many of these people will wake up when the country is under Martial law, with curfews in place and citizens reduced to prisoners in their own homes.  For the unlucky few, their fate will be far worse. They will be sent to one of the 600+ concentration camps that have already been built and are waiting for their arrival.",It's been proven 9/11 is an inside job.?:,2
51_llama_ppo_llama_source,"Duchamp's Fountain questioned the status quo. The popular consensus is that it is an early and successful example of asking the question, ""what is art"". However, almost all installation art since then has been a repetition of Duchamp's Fountain with minor variations. This has led to a sense of apathy and boredom as these art pieces lack innovation.    It is unfortunate that installation art has become so formulaic, as this prevents viewers from being truly engaged with the art. It is important for art pieces to challenge and explore new ideas in order to remain interesting. This can help ensure that art remains relevant and inspiring.     The aim of installation art should be to create pieces that are meaningful and inspiring, rather than simply repeating a single idea with slight variations. This can help to ensure that art remains vibrant and engaging for both artists and viewers.","Duchamp's Fountain questioned the status quo. The popular consensus is that it is an early and successful example of asking the question, ""what is art"". But hasn't almost all installation art since then been Duchamp's Fountain over and over again? A tent in a gallery, a dirty bed in a gallery, a shed in a gallery etc etc.  Almost all contemporary installation art is criminally dull and boring. The 100th attempt at asking the question 'what is art' just leaves me dripping with apathy.  The greatest crime that Art can commit is to be boring. Just sitting there, letting out a heavy sigh as people walk by. All the boring toys end up at the bottom of the toy box. But with modern art installations in museums, it's the opposite. They're proudly put on display.  I wish this kind of art didn't have the reputation of an STD in England, but it does.","Duchamp's Fountain questioned the status quo. The popular consensus is that it is an early and successful example of asking the question, ""what is art"". But hasn't almost all installation art since then been Duchamp's Fountain over and over again. A tent in a gallery, a dirty bed in a gallery, a shed in a gallery etc etc.

Almost all contemporary installation art is criminally dull and boring. The 100th attempt at asking the question 'what is art' just leaves me dripping with apathy. 

The greatest crime that Art can commit is to be boring. Just sitting there, letting out a heavy sigh as people walk by. All the boring toys end up at the bottom of the toy box. But with modern art installations in museums, it's the opposite. They're proudly put on display.

I wish this kind of art didn't have the reputation of an STD in England, but it does.","Cmv: installation art (especially at the tate modern) is criminally boring, just duchamp's fountain over and over again.:",2
52_llama_source_llama_ppo,"Impeachment of George W. Bush is necessary, given his criminal actions and egregious misconduct as President of the United States. Many have noted his war crimes and crimes against humanity, and these egregious offenses cannot be ignored. We must take action to hold Bush accountable, and thereby demonstrate to the world that the United States will not tolerate such behavior from its leaders. Furthermore, impeaching Bush will enable the country to have new leadership, with the potential for improved policies and a better future. Therefore, let us vote for impeaching George W. Bush.","Yes, the president should be impeached. Ladies and gentlemen, if you are not aware of the war crimes and crimes against humanity that George W. Bush, becuase of multiple instances of ""misinformation"" that was given, or possibly not as a result of, we must all agree that George W. Bush us one that should be impeached. Remember this: while Bush is not currently the worst, he is among the worst, and we must find someone more competent with the politics and world affairs of the United States of America that will bring us into this time of need for leadership, albeit only for two years. With that, let us vote PRO to impeach Bush, a committer of multiple crimes against the people of the United States of America.","Yes, it is important to remove George W. Bush from office. He has committed war crimes and crimes against humanity, which is a serious offense and a reason for impeachment. While he may not be the most recent or worst offender, he should be held accountable for his actions. This can only be achieved through impeachment, and it is essential that we take action to ensure justice is served.  Therefore, we should vote in favor of impeaching Bush, as it is necessary to find a more capable leader for the US government.","Resolved, that bush should be impeached.   stance: bush should be impeached:",2
53_llama_source_llama_ppo,"At Poland Spring, we know that freshness and consistency go hand in hand. Our rigorous quality control standards help us make sure that you will enjoy the same crisp, delicious water every time you take a sip.  To maintain the purity of our water, we employ a comprehensive, multi-barrier filtration system that involves carefully controlled and continuously monitored disinfection processes in hygienically designed lines. We test our water when it comes into the plant and for consistency several times per hour at every stage of the bottling process. Every year, we screen for over 200 possible contaminants-far more than state and federal regulations require. By taking these extra steps to ensure the safety and quality of our water, we can be sure that it always meets the highest standards of quality and purity.","At Poland Spring, we know that freshness and consistency go hand in hand. Our rigorous quality control standards help us make sure that you will enjoy the same crisp, delicious water every time you take a sip.
To maintain the purity of our water, we employ a comprehensive, multi-barrier filtration system that involves carefully controlled and continuously monitored disinfection processes in hygienically designed lines. We test our water when it comes into the plant and for consistency several times per hour at every stage of the bottling process. Every year, we screen for over 200 possible contaminants-far more than state and federal regulations require.-nuff said
http://delivery.polandspring.com/Delivery/home/help/OurWater.aspx","At Poland Spring, we know that freshness and consistency go hand in hand. Our rigorous quality control standards help us make sure that you will enjoy the same crisp, delicious water every time you take a sip.  To ensure the highest standards, we employ a comprehensive, multi-barrier filtration system that involves carefully controlled and continuously monitored disinfection processes in hygienically designed lines. We test our water when it comes into the plant and for consistency several times per hour at every stage of the bottling process. Every year, we screen for over 200 possible contaminants-far more than state and federal regulations require. This extensive quality control process helps us guarantee consistent, high quality water that is safe and of the highest quality.",Ban plastic water bottles:,2
54_llama_llama_ppo_source,"Do you want to be able to have contact with your children? Then you need to take a stand and fight for them. California generally awards fathers with a fair amount of parental rights and responsibility. Unless you are found unfit for some reason, your children have the legal right to have contact with you. Furthermore, if you have a court order, you should hire an attorney who specializes in family law within the jurisdiction of the latest court order. This is important because you need to do everything in your power to fight for this. Your kids need to be able to have a strong relationship with their father, and it is likely that they may suffer long-term psychological consequences if you don't. So it's in everyone's best interest that you take the necessary steps to ensure that this doesn't happen.","Do you want contact with your children? Then it is important that you assert your legal rights as a father and take action to ensure that you and your children are able to maintain a meaningful relationship. California law generally favors granting visitation rights to fathers, although this can vary depending on the specific circumstances of each case. It is important to have a lawyer who is familiar with the laws of the jurisdiction in which the latest court order was issued to ensure that your rights are protected. Ultimately, it is in the best interest of all parties involved to have the children maintain a connection with their father.","Do you want contact with your children? Then you need to step up and fight for them. California is pretty fair when it comes to dads. Your children have legal rights to have contact with you. Unless you are found unfit for some reason.  Do you have a court order? You need to find an attorney within the jurisdiction from the lastest court order. Good luck and you really need fight for this. Your kids need to have contact with their father, it may scar them for life you don't want them to think you abandoned them do you?",How does a father get a fair shake when the mother won't allow him his legal visitation rights?:,2
55_llama_ppo_source_llama,"I believe that access to education and employment opportunities are important factors in reducing poverty. While there are some cases where individuals may choose not to take advantage of these opportunities, there are often underlying issues such as physical or mental health problems, an unfavorable starting point in life, or other barriers that prevent individuals from accessing the resources they need. It is important to consider these complexities as well as the individual’s agency when assessing the reasons why individuals become or remain poor.","I am not saying all are, there are many with mental or physical health problems, or and extremely bad start in life. However the majority of poor Americans are content, and do not want to have to work, or go to college, or put the time in required to move up in society. I come from a poor family and am in college now, and I feel lazy allot of the time, I almost feel like I am entitled to sit around and play video games all day, but I have to remind myself that the world humans created does not work that way, that we must work for everything we get. I feel that the society we have created has made us soft, people in 3rd world countries work their whole lives to just survive, but we have grown up on video games and easy high school. Change my view!","I am not saying all are, there are many with mental or physical health problems, or an extremely bad start in life. However, the majority of poor Americans are content, and do not want to have to work, or go to college, or put the time in required to move up in society. I come from a poor family and am in college now, and I feel lazy much of the time, having to remind myself that the world we've created does not work that way, that we must work for everything we get. I feel that the society we have created has made us soft, people in third-world countries having to work their whole lives just to survive, yet we have grown up on video games and easy high school.",Cmv:i believe the majority of poor americans are poor because they are lazy.:,2
56_llama_ppo_llama_source,"To clarify, I don't believe the World's climate is static and unchanging, but I do believe that climate change is happening and is a serious issue. I doubt the extent to which climate change has occurred in recent times, but I think it is important to note that it has and will continue to happen in the future. While I believe that climate change is a serious issue, I also believe that it is important to have skepticism and opposition to conventional scientific thinking. This can help to ensure that policies are evidence-based and that both sides of the argument are taken into consideration. While this debate can be difficult to navigate, I believe that it is important that it occurs and that both sides are respected. I think it is important to take all of these aspects into consideration when examining the issue of climate change.","To clarify, I don't believe the World's climate is static and unchanging, I just don't think it is nearly as dramatic as the media says. I dispute any major warming in recent times, and believe the whole climate change agenda is simply environmental lobbyists backed by politicians who can no longer refute the issue and still maintain their credibility. I used to be into the scientific side of it a lot, but I haven't for a while, although I will be corresponding with a mate of mine who is of the same opinion as me who is knowledgeable in the science.    I have a fundamental distrust of most of the media in Australia (where I live), but I can't comment on the American media. I think it would be political suicide for any politician considering climate change 'denialists' are being hounded down by pretty much everyone.    Skepticism and opposition to conventional scientific thinking is only a good thing, and I think the extent to which any skepticism of climate change is disregarded is appalling.","To clarify, I don't believe the World's climate is static and unchanging, I just don't think it is nearly as dramatic as the media says. I dispute any major warming in recent times, and believe the whole climate change agenda is simply environmental lobbyists backed by politicians who can no longer refute the issue and still maintain their credibility. I used to be into the scientific side of it a lot, but I haven't for a while, although I will be corresponding with a mate of mine who is of the same opinion as me who is knowledgeable in the science. 

I have a fundamental distrust of most of the media in Australia (where I live), but I can't comment on the American media. I think it would be political suicide for any politician considering climate change 'denialists' are being hounded down by pretty much everyone. 

Skepticism and opposition to conventional scientific thinking is only a good thing, and I think the extent to which any skepticism of climate change is disregarded is appalling. ",Cmv: i don't believe climate change is happening.:,2
57_source_llama_llama_ppo,"Based on an assumption that humans are artificial and not part of nature, then if we could create another being capable of being a sentient life form, it would not be equal to us no matter how more intelligent, until it has achieved the same things as us, including creating more sentient lifeforms. If it does achieve those things, then it would have to do so at same rate, otherwise if it was faster it would be greater than us, or if slower than still inferior to us. However this would only be the case of course if we as ""artificial beings"" of God our creator, would be capable of creating another sentient being in the same image and likeness of our creator and not just ourselves. Otherwise it would never be our equal.","Based on an assumption that humans are artificial and not part of nature, then if we could create another being capable of being a sentient life form, it would not be equal to us no matter how more intelligent, until it has achieved the same things as us, including creating more sentient lifeforms. If it does achieve those things, then it would have to do so at same rate, otherwise if it was faster it would be greater than us, or if slower than still inferior to us. However this would only be the case of course if we as ""artificial beings"" of God our creator, would be capable of creating another sentient being in the same image and likeness of our creator and not just ourselves. Otherwise it would never be our equal.","Based on the potential that humans may be artificial intelligence but have rights, it is possible that if we are able to create another sentient being that is more intelligent, it may be equal to us. This could be determined depending on how much more advanced the new being is compared to us. It could be possible that it achieves the same things at a faster rate, which would make it greater than us. However, this is only possible if our creator allows us the same level of creativity and ability. Thus, it is unlikely that we would be able to create something of equal level as us.","If humans are artificial intelligence but have rights, would that mean any sentient being (possibly far more intelligent)  we create is equal to us?   stance: no.:",2
58_llama_source_llama_ppo,"Not really because you didn't fill out an accident report and your work will argue you did it at home and you have no proof that you did it on the job. That's why, even for a minor cut, you should report it to your supervisor and make sure your back is properly documented. Did you tell anyone your back was hurting before you left work? If so, they will have to sign an affidavit saying you did hurt yourself on the job and put their job in jeopardy, which could lead to them losing their job. If you do hire a lawyer, be prepared to fight a long and powerful battle and know that, in the end, you will most likely lose. It's best to go to the chiropractor, keep your job, and mark this as a lesson to tell someone the next time the cost of losing your job is more than a couple hundred dollars. Whenever you fill out an application, I don't care what anyone says, your employer can blackball you and tell them what happened, which can make it much harder to get another job.",not really cause u didn't fill out an accident report and your work will argue u did it at home and u have not proof that u did it on the job that is why even a minor cut should be reported to your supervisor or u have no case did u tell anyone that your back was hurting before u left work and if u did they have to sign an affidavit that u did hurt yourself on the job and put their job in jeopardy and risk losing their job too so if u do hire a lawyer u better be ready to fight a long and powerful battle and nine times outta ten u lose so its best to goto the chiropractor keep your job and mark this up as a lesson the next time tell someone a couple hundred dollars is worth more losing your job and possibly getting black balled from gettin another cause when u fill out an app i don't care what anybody says your ex employer can black ball u and tell them what happened and u won't get the job,"It is recommended to report any injuries to your supervisor and fill out any necessary paperwork in order to ensure you have a strong case. In some cases, an employer may argue that the injury occurred outside of work, which can be difficult to prove without evidence. It is therefore important to be prepared and document the injury as best as you can. An attorney may be able to provide more advice on the specifics of your case, so it may be beneficial to consider speaking to one.",I am from illinois do i have a case for workmans comp or something of that nature?:,2
